Название,Автор,Ссылка,Рейтинг,Количество голосов,Цена,Количество страниц,Количество отзывов,Текст отзывов,Возраст,Год
Программирование на C++ в примерах и задачах,Алексей Васильев,https://www.litres.ru/book/aleksey-nikolaevich-vasilev/programmirovanie-na-c-v-primerah-i-zadachah-22054458/,"3,9",78,419 ₽,Объем 369 страниц,16,"['Я купил эту книгу в бумажном виде, прочитав страниц 100 в моей голове ровно ничего не произошло (это не значит что у меня там пусто). В книге объясняется все плохо!!! Никаких внятных объяснений, в названии говорится что там есть примеры там их нет. В книге все написано в сложных формулировках и туманно то есть не понятно. Такая книга кроме головной боли ничего не принесёт. Худшее для начинающих. И задания которые даются в конце параграфа, давать новичку задания когда он еще даже основ не знает, боже как тупо.', 'MYKYTA SLIUSAREV, Ваше негодования ни к чему! Скорее всего у вас нету мозгов, чтобы понимать материал. Книга прекрасная и в ней ""Примеры"" - это листинги и шаблоны. А слова ""Худшее для новичков"" в полной мере не походит. Здесь нужно вникать в текст, там всё расписано. В том числе, как и какая команда работает.', 'Отличная книга для тех, кто реально хочет научиться. И я не согласен с нытьем других комментаторов. Все хорошо объясняется, но не стоит думать, что на одной книге вы превратитесь в в гения программиста.', 'К сожалению данного автора советовать не могу. Всё дано одной кучей, чувство такое что тебя за час хотят научить программировать на с++ и дают за этот час все от базы до ООП. Написано легко, объясняется все понятным языком но информация подаётся вся и сразу что наврятли уложиться в голове новичка не знакомого с программированием.', 'Кратко: книга не про программирование на C++, а про решение математических задач.Не кратко: Книга произвела на меня впечатление того, что она не учит программированию на C++, а учит решать математические задачи с использованием данного языка программирования и всё бы ничего, но проблема заключается в том, что автор не объясняет эти самые математические задачи.Например,Спойлер«По определению биномиальные коэффициенты вычисляются как *формула*, где использовано обозначение для факториала числа *формула*. Несложно заметить, что *формула* = *формула*, а также *формула*, *формула*, *формула* и так далее. Мы в программе воспользуемся рекуррентным соотношением *формула*.»Ни одна из формул не объяснена, непонятно по какой причине C от n до k равняется C от n до n-k, непонятно по какой причине C от n до 0 равняется 1, C от n до 1 равняется 1 и как C от n до 2 равняется (n*(n-1))/2, непонятно откуда взялось рекуррентное соотношение. Прикрепил бы ссылки на источники, которые доказывают выше перечисленные формулы и откуда они вообще взялись. Понимаю, что для людей, которые посвятили свою жизнь математике моя претензия, что какая-то из формул для меня не совсем очевидна, покажется глупой, но как по мне давать такой материал в ПЕРВОЙ главе является не самом удачным решением.', 'Советую книгу Васильев А Н самоучитель С++ с задачами и примерами издательства НиТ. Иногда я её до сих пор открываю, чтобы потренировать мозги.']",Возрастное ограничение: 12+,Дата написания: 2017
Основы Python для Data Science (pdf + epub),Кеннеди Берман,https://www.litres.ru/book/kennedi-berman/osnovy-python-dlya-data-science-pdf-epub-69154048/,"5,0",1,499 ₽,Объем 272 страницы,1,"['Книга подойдет тем, кто уже имеет опыт в программировании (на любом языке). Примеры хорошо разжеваны и прокомментированы. Большой плюс - книга написана инженером-пограммистом, так что вы не увидите тут ошибок, типичных для ситуации когда концепции из области программирования пытается объяснить аналитик-прикладник. Местами изложение суховато (глава про функциональное программирование) но материал все равно понятен и изложен без лишних (для начинающего в теме читателя) подробностей.']",Возрастное ограничение: 16+,Дата написания: 2022
Пользовательские истории. Искусство гибкой разработки ПО,Джефф Паттон,https://www.litres.ru/book/dzheff-patton/polzovatelskie-istorii-iskusstvo-gibkoy-razrabotki-po-24396028/,"4,4",31,755 ₽,Объем 393 страницы,8,"['За книгу 5 баллов, за перевод 1 балл. Некоторые обороты просто ужасны и не адаптированы на русский язык. Переведено как будто дословно в том порядке в каком написаны английские слова. Разве так можно???', 'Дмитрий Куликов, раз вы так экспертно об этот заявляете – читайте в оригинале, какие проблемы?', 'Занимаюсь проектирование программного обеспечения и информационных систем более 10 лет. Могу с уверенностью сказать, что книга очень хорошая. В книге хорошо описана концепция пользовательских историй в контексте разработки ПО (зачем они нужно и что дают?). При этом в книге множество конкретных примеров и практических рекомендаций для применения. Книга будет очень полезна для начинающих аналитиков, менеджеров продукта и в целом всем участникам проектов по разработке ПО. Пользовательские истории это общий знаменатель для всех участников проектных команд.', 'отличная книга с детальным пояснением того, что дают карты историй, как их применять на практике. приведены живые примеры коллег автора. очень легко читается, как диалог с автором', 'Много примеров в каждой главе – это здорово. Но книге не хватает одного сквозного примера, который бы прорабатывался с каждой главой.Процесс пользовательских историй можно и нужно алгоритмизировать. И если посмотреть «сверху» на содержание, то четко этот алгоритм уже виден в книге, включая оценку и исправление ошибок, допущенных на первых шагах создания пользовательской истории.Внимательный читатель увидит, на какой именно алгоритм (давно разработанный нашим советским изобретателем) похож предлагаемый автором книги подход.Автор использует очень много метафор, но к сожалению, они не запоминаются и сильно перегружают книгу.И кажется, в книге только одна полезная и важная идея: больше общаться с другими людьми, больше их спрашивать, а не придумывать за них.У меня сложилось представление, что книга не про разработку ПО, а про то, что нужно больше общаться. Вообще – просто больше общаться. (а я связан с разработкой ПО более 10 лет)', 'Книга полезная, есть продвинутые идеи относительно основателей. Есть смысл почитать и начинающим и опытным, не только разработчикам ПО, но и всем, кто проявляет интерес к новим методам работы над интеллектуально-емкими продуктами.']",Возрастное ограничение: 12+,Дата написания: 2014
"Технология. 3D-моделирование, прототипирование и макетирование. 9 класс",А. В. Гриншкун,https://www.litres.ru/book/a-v-grinshkun/tehnologiya-3d-modelirovanie-prototipirovanie-i-maketirovani-68297144/,"5,0",1,500 ₽,Объем 65 страниц,,[],Возрастное ограничение: 0+,Дата написания: 2022
Объектно-ориентированное программирование с помощью Python,Ирв Кальб,https://www.litres.ru/book/irv-kalb/obektno-orientirovannoe-programmirovanie-s-pomoschu-python-70281793/,"4,3",3,749 ₽,Объем 515 страниц,3,"['Книга однозначно полезная, читать интересно, добавляет знаний по ООП, только работать с ней неудобно, нет оглавления. Добавьте оглавление поставлю 5 звезд.', 'Отличная книга для всех желающих освоить объектно-ориентированное программирование в современном и востребованном языке высокого уровня Python.', 'Отличная книга про реализацию различных аспектов обьектно-ориентированного программирования на Python с отпажением различных интересных примеров']",Возрастное ограничение: 12+,Дата написания: 2022
Как быть успешным в Data Science. Эффективное управление проектами и развитие профессиональной команды,Цзикэ Чонг,https://www.litres.ru/book/czike-chong/kak-byt-uspeshnym-v-data-science-effektivnoe-upravlenie-proekt-70499026/,"5,0",1,749 ₽,Объем 642 страницы,,[],Возрастное ограничение: 12+,Дата написания: 2021
Arduino®. Полный учебный курс. От игры к инженерному проекту,А. А. Салахова,https://www.litres.ru/book/a-a-salahova/arduino-r-polnyy-uchebnyy-kurs-ot-igry-k-inzhenernomu-proektu-56509900/,"3,7",7,410 ₽,Объем 178 страниц,2,"['Так вышло, что в момент выхода книга меня не заинтересовала, но времена меняются, и вот я держу это прекрасно изданную книгу в руках...\nКнига, как и заявлено, является курсом, курсом, хорошо спланированным педагогами высокой квалификации. Однако, я как инженер был прежде всего приятно удивлён и порадован хорошим инженерным уровнем работы. Предмет книги находится на стыке трёх ключевых инженерных областей 21-ого века: схемотехники, программирования и робототехники. Строгость и глубина изложения, чёткость терминологии, аккуратность в технических деталях создают атмосферу профессионализма. Хотя я не первый день в деле популяризации программирования микроконтроллеров, я почерпнул для себя немало нового и интересного, например, о платформе виртуального прототипирования и языках производственной робототехники. Если говорить о заключительной части, относящейся к проектной деятельности, то здесь я встретил понятия, которые изучал не на студенческой скамье, а ""в бою"", в Кремниевой долине, относительно недавно.\nОтветственно заявляю, что подобной книги на русском языке для ""конкурирующего"" микроконтроллера микро:бит на сегодня нет.\nЧтение лёгким не назовешь, но мотивированный читатель почерпнёт многое, может быть - профессиональное вдохновение на всю жизнь. - М.Н. Семионенков, автор и переводчик материалов по обучению школьников основам программирования и робототехники, автор книги ""Путешествие в Робокодию"", к.ф.-м.н.', 'Книга очень интересная советую всем! Рассмотрены графические языки программирования Snap! и ArduBlock это круто. Кроме того, вы научитесь читать, составлять и собирать действующие схемы из электронных компонентов.']",Возрастное ограничение: 12+,Дата написания: 2024
