Название,Автор,Ссылка,Рейтинг,Количество голосов,Цена,Количество страниц,Количество отзывов,Текст отзывов,Возраст,Год
"Байесовская статистика: Star Wars, LEGO, резиновые уточки и многое другое",Уилл Курт,https://www.litres.ru/book/uill-kurt-30699932/bayesovskaya-statistika-star-wars-lego-rezinovye-utochk-65486692/,"4,6",7,699 ₽,Объем 304 страницы,5,"['Безусловно, это великолепная книга. как только появился перевод на русский - купил, чтобы выразить уважени автора. Изначально читал на английском. Как правило идеи байесовско статистики даются или уж совсем поверхностно, на уровне научпопа, или тяжелым казенным языком лекций по математике. Эта книга идеальный баланс. Прочитав, усвоив и поигравшись с темами, вы вполне будете понимать предмет на понятийном уровне.Важнейший плюс книги - автору удалось сделать последовательный материал в котором ничего не упущено, при этом он не считает вас настолько тупым, чтобы избегать формул и графиков. по ходу поговорит и о распределениях и о тервере, но ровно столько, чтобы не скатиться в унылые лекции.', 'Интересная книга по азам математической статистики, определённо будет полезной при работе с наборами собственноручно собранных данных, порадовали примеры применения языка R. Однако изложение материала - довольно сумбурное. Вроде про математику, а списка использованных определений нет - довольно неудобно при работе с книгой, причём с ней ведь именно работать надо. Автор или переводчик периодически путает вероятность с её плотностью, например на рис. 5.3, стр. 80 - значение вероятности по оси Y графика, больше 4, а на рис. 5.4, стр. 83, вообще более 200! Какие ещё в книге есть чудеса, сказать сложно, в спорных вопросах - обязательно сверяться с другими источниками.', 'Очень содержательно и доходчиво раскрыты непростые вопросы. Приложение поможет практикам вспомнить вузовскую математику. Книга поможет приступить к изучению современных статистических методов.', 'Замечательная книга, в которой на пальцах, простым языком, с привлечением понятных примеров из жизни рассказывается об основах теории вероятностей с переходом к байесовской статистике.Теорема Байеса - это математический инструмент, который позволяет оценить вероятность какого-либо события при выполнении определенного условия, исходя из накопленных данных наблюдений. При этом, если информация об окружающем мире изменилась, в наблюдениях появились новые уточняющие вводные, то они легко учитываются в вычислениях.Какова вероятность того, что вы заболели ковидом, если пришел положительный результат теста? Какова вероятность того, что купив случайный билет на стадион вы окажетесь в секторе гостевой команды? Книга дает читателю в руки необходимый инструментарий, чтобы отвечать на такие вопросы, и учит обращаться с этим инструментарием с помощью наглядных примеров и несложных упражнений.В книге также дается информация о распределениях случайной величины, достаточная для того, чтобы строить несложные модели случайных событий. Например, если у вас есть статистические данные о футбольном сезоне (сколько в среднем за матч забивала та или иная команда дома или на выезде), то информация из этой книги позволяет вам смоделировать такой сезон и оценить, какие шансы на чемпионством у той или иной команды.Прочитал книгу на одном дыхании с огромным удовольствием.', 'Книга странная. Видимо особенности перевода. Всякие ляпы в тексте типа… 0.53=0.123. Кроме бета распределения и нормального распределения, а также мат ожидания дисперсии и стандартного отклонения там ничего нет. Ну и конечно формула Байеса. Книга достаточно бесполезна, ну и язык R в качестве основного примера очень спорен.']",Возрастное ограничение: 16+,Дата написания: 2019
Справочник Жаркова по проектированию и программированию искусственного интеллекта. Том 10: Программирование на Visual C# искусственного интеллекта. Издание 3. Продолжение 1,Валерий Алексеевич Жарков,https://www.litres.ru/book/valeriy-zharkov-3244/spravochnik-zharkova-po-proektirovaniu-i-programmirov-68918598/,0,,199 ₽,Объем 195 страниц,,[],Возрастное ограничение: 12+,Дата написания: 2023
QA Engineer,Михаил Семынин,https://www.litres.ru/book/mihail-semynin/qa-engineer-70826371/,"4,9",45,,Объем 126 страниц,1,"['Действительно профессиональная книга, написанная летящим и понятным языком (хотя и о таких сложных вещах!). Рекомендую, если хотите погрузиться в связанные профессии, а также могу предложить тем, кто только выбирает работу своей мечты']",Возрастное ограничение: 12+,Дата написания: 2024
Google App Engine Java и Google Web Toolkit: разработка Web-приложений,Тимур Машнин,https://www.litres.ru/book/timur-mashnin-301845/google-app-engine-java-i-google-web-toolkit-razrabotk-7061637/,"5,0",4,303 ₽,Объем 349 страниц,1,"['Хорошее введениеКупил эту книгу для знакомства с технологией – основную часть времени работа с js. Когда начал работать с примерами наткнулся на использование не самых новых версий ( это ожидаемо, но неприятно ). После пары часов возни с попыткой подобрать версии пакетов – плюнул и начал просто читать. Не уверен, что книги достаточно для старта работы, но чтобы представлять примерно возможности и ограничений – вполне подходитНе считаю технологию актуальной ( и после прочтения книги мнение ниразу не изменилось ) так советовать никому кто с стеком не работает не стану. А тем кто работает – лучше взять англоязычные книги ( которых оказалось в свободном доступе предостаточно )']",Возрастное ограничение: 0+,Дата написания: 2014
Python – это просто. Пошаговое руководство по программированию и анализу данных,Нилаб Нисчал,https://www.litres.ru/book/nilab-nischal/python-eto-prosto-poshagovoe-rukovodstvo-po-programmirovaniu-68998078/,"4,5",4,549 ₽,Объем 411 страниц,4,"['Очень подробное описание библиотечек по работе с анализом данных.Пошагово рассказано как с ними работать, руководство можно сказать с нуля', 'С одной стороны из книги действительно можно узнать много полезного, применимого на практике, и даже людям, далёким от Питона и программирования книга может оказаться полезной. В частности тем, кто не хочет покупать лицензию какого-нибудь МатЛаба...Но некоторые опусы автора просто шокируют своей безграмотностью. Например когда нам сперва рассказали про чудесную среду разработки, в которой можно замечательно редактировать код, нам после этого предлагают открыть обычный блокнот(!) Да-да! Именно тот самый блокнот - голубенькая книжечка, который есть в каждом Виндовсе. И не просто так - чтобы выполнить некоторый челендж! Автор всерьёз предлагает таким образом написать код. Автор даже рассказывает, как исправить возникающие при такой работе неполадки, связанные с кодировками! Зачем мы тогда скачивали среду разработки? Вобщем - если вы опытный разработчик - обязательно почитайте сей опус, чтобы поржать! Если-же вы новичок - выполните упражнения этой книги, но для серьёзного овладения Python возьмите какой-нибудь другой учебник!', 'Не верю, что наконец то можно скачать образовательную книгу и нормально с ней поработать. Обычно доступ только через приложение Литрес к подобной литературе, с очень медленной прокруткой, без поиска по оглавлению и словам.', 'Во фрагменте много тянущегося введения и в конце hello world. Очень не информативно и до конца ее понятно на сколько понятно будет изложен материал.  Остаются в итоге сомнения стоит того или нет.']",Возрастное ограничение: 16+,Дата написания: 2021
Создание настольных Python приложений с графическим интерфейсом пользователя,Тимур Машнин,https://www.litres.ru/book/timur-mashnin-301845/sozdanie-nastolnyh-python-prilozheniy-s-graficheskim-65059196/,"4,0",29,490 ₽,Объем 147 страниц,13,"['Очень познавательно, правда сначала нужно изучить основы языка Python. И эта книга дает полный обзор возможностей для написания десктоп на Python', 'Хорошая книга, интересная. Рекомендую. Подошла. Хотя можно и больше информации было дать. С другой стороны все нужно нашел.', 'Полезно и интересно. Много примеров. Буду пользоваться для написания кода. Рекомендую к прочтению после изучения основ Python.', 'Четко и по делу. Все понятно, можно понять различие между платформами и как практически писать программы. Понравилось, еще раз перечитаю.', 'Мне книга понравилась. Все написано подробно и по делу, по шагам. Материал изложен доступно и понятно. Хорошие иллюстрации, много примеров.']",Возрастное ограничение: 12+,Дата написания: 2021
Julia. Язык программирования. Быстрый старт,Вадим Никитин,https://www.litres.ru/book/vadim-nikitin-32700223/julia-yazyk-programmirovaniya-bystryy-start-69596290/,"5,0",7,690 ₽,Объем 107 страниц,4,"['Первая книга о Julia, которую я вообще встретила. Очень хорошо написана, супер-простым языком с конкретными примерами и простыми шагами. В самый раз для тех, кто только начинает разбираться в программировании и владеет только базовыми понятиями. Обучалка из разряда смотри - повторяй.', 'Хорошо написанная, простая и понятная книга. Емко, пошагово, наглядно - разберется даже ребенок. Действительно, можно держать книгу под рукой без необходимости гуглить информацию, плюс очень удобно, что есть ссылки на источники. Короче, не книга, а находка!', 'Искренне рекомендую данную книгу по причинам:1. Текстовый формат. Почти все электронные книги по программированию представлены в формате PDF (некоторые даже в DJVU), который очень трудно читать со смартфона. Нужен планшет или хорошая читалка. Автор данной книги предоставил ее ЛитРес в тексте, благодаря чему ее удобно читать везде, а еще можно делать пометки.2. Информативность. Материал отлично структурирован и качественно переведен. По сравнению с чтением официальных мануалов (даже при отсутствии проблем с английским языком) книга сэкономит вам кучу времени.Это действительно отличная книга по Julia, которая знакомит как с азами языка, так и с некоторыми тонкостями, которые сильно помогут в дальнейшем освоении. Julia сама по себе логична и последовательна, и когда вы попытаетесь применить базовые приемы из книги к новым типам объектов, они почти всегда будут вести себя так, как вы ожидаете.', 'Искренне рекомендую данную книгу по причинам:1. Текстовый формат. Почти все электронные книги по программированию представлены в формате PDF (некоторые даже в DJVU), который очень трудно читать со смартфона. Нужен планшет или хорошая читалка. Автор данной книги предоставил ее ЛитРес в тексте, благодаря чему ее удобно читать везде, а еще можно делать пометки.2. Информативность. Материал отлично структурирован и качественно переведен. По сравнению с чтением официальных мануалов (даже при условии отсутствия проблем с английским языком) книга сэкономит вам кучу времени.Это действительно отличная книга по Julia, которая знакомит как с азами языка, так и с некоторыми тонкостями, которые сильно помогут в дальнейшем освоении. Julia сама по себе логична и последовательна, и когда вы попытаетесь применить базовые приемы из книги к новым типам объектов, они почти всегда будут вести себя так, как вы ожидаете.', 'Андрей Павлюченко, почему-то напечаталось два одинаковых отзыва :(']",Возрастное ограничение: 12+,Дата написания: 2023
Life Coder,Гадель Загрутдинов,https://www.litres.ru/book/gadel-zagrutdinov/life-coder-69001012/,"4,1",9,"49,90 ₽",Объем 5 страниц,3,"['автору книги 0 лет. Данная книга не несёт в себе никакого информатива. если описать еë в двух словах это будет: как я провёл ле… ой, как я стал программистом. популистские высказывания, которые можно найти на любом ютуб-ролике о программировании за бесплатно. а тут получается ситуация как будто ты спрашиваешь как дела, тебе отвечают и берут с тебя ещë и деньги. хоть и 50 рублей, но я бы лучше дошика поел за эту цену.', 'Короткий рассказ про путь программиста. Про путь без дорогих курсов, а с помощью самообразования. Интересно. Мотивирует. ', 'Классная история! Интересно было читать! Особенно, когда ты знаешь этого парня с пелёнок ) Я помню как ты показал свою первую игру, это было здорово и я была удивлена, что это ты сделал сам!']",Возрастное ограничение: 18+,Дата написания: 2023
От джуна до сеньора. Как стать востребованным разработчиком,Владимир Швец,https://www.litres.ru/audiobook/vladimir-shvec-32351/ot-dzhuna-do-senora-kak-stat-vostrebovannym-razrabotc-68635922/,"4,6",22,699 ₽,Длительность книги 4 ч. 23 мин.,5,"['Хорошая книга. Простым и понятным языком (и без воды, что немаловажно) рассказывает начинающему разработчику с чем ему придётся столкнуться и даёт полезные советы о том, как преодолеть различные сложности, и по итогу стать более квалифицированным специалистом.', 'отличная книга для новичков. Много практических советов и примеров из жизни. Правильно расставлены акценты и сфокусировано внимание на специфике работы программистом. Показаны минусы и плюсы с чем придется столкнуться тому, кто решит им стать', 'Очень свежо и по делу. Автору спасибо! Ровно год, как я стал бэкенд разработчиком, индустрия очень захватывающая. Книга может стать настольной для каждого из сферы айти. Рекомендую!', 'Рекомендую эту книгу особенно новичкам в ИТ. Не обязательно разработчикам, будет полезна и тестировщикам. Чётко и по делу.', 'Автор делится своим опытом в айти, дает советы, как не выгорать, как относится к неудачам, удачам, как строить отношения с коллегами, почему важно отдыхать и т.д. Возможно, кому-то это книга поможет.']",Возрастное ограничение: 0+,Дата написания: 2023
